{
  "schemaVersion": 1,
  "id": "dotnet-11-preview-linux-x64",
  "image": "sharplabnext/runtime-dotnet11:dev",
  "family": "coreclr",
  "acceptedRuntimeFamilies": [],
  "acceptedFrameworks": [
    {
      "name": "Microsoft.NETCore.App",
      "exactVersion": "11.0.0-preview.5.26302.115"
    }
  ],
  "runtimeVersion": "11.0.0-preview.5.26302.115",
  "runtimeCommit": "f7b4c5716faaee8fb8a289aed29118cad955c45f",
  "jitVersion": "11.0.0-preview.5.26302.115",
  "jitCommit": "f7b4c5716faaee8fb8a289aed29118cad955c45f",
  "runtimeImageId": "sharplabnext/runtime-dotnet11:dev",
  "rid": "linux-x64",
  "architecture": "x64",
  "cpuFeatureProfile": "x64-v2",
  "acceptedArtifactFormats": [
    "dotnet-managed-pe-v1"
  ],
  "capabilities": [
    "run",
    "jit-asm",
    "inspection",
    "execution-flow"
  ],
  "providedRuntimeFeatureTags": [
    "runtime.dotnet-11-preview"
  ],
  "providedMetadataFeatureTags": [],
  "allowedSecurityPolicyIds": [
    "runtime-job-default"
  ],
  "container": {
    "isolationKind": "standard",
    "environmentKind": "coreclr",
    "executionUser": "1654:1654"
  },
  "operations": {
    "run": {
      "implementationId": "sharplabnext-runner-v1",
      "pathStyle": "unix",
      "command": {
        "executable": "dotnet",
        "argv": [
          "/opt/sharplabnext/SharpLabNext.Runner.dll",
          "{entryAssembly}",
          "--",
          "{arguments}"
        ]
      }
    },
    "jit": {
      "implementationId": "sharplabnext-jit-inspector-v1",
      "pathStyle": "unix",
      "command": {
        "executable": "dotnet",
        "argv": [
          "/opt/sharplabnext/SharpLabNext.JitInspector.dll",
          "{entryAssembly}",
          "{methodFilter}"
        ]
      },
      "sourceMappingKind": "linux-profiler",
      "profilerPath": "/opt/sharplabnext/SharpLabNext.JitProfiler.so"
    }
  },
  "layout": {
    "runnerKind": "dotnet",
    "dotNetHostPath": "dotnet",
    "runnerAssemblyPath": "/opt/sharplabnext/SharpLabNext.Runner.dll",
    "jitInspectorAssemblyPath": "/opt/sharplabnext/SharpLabNext.JitInspector.dll"
  },
  "securityPolicies": [
    {
      "id": "runtime-job-default",
      "memoryBytes": 268435456,
      "nanoCpus": 1000000000,
      "pidsLimit": 64,
      "maximumDurationSeconds": 10,
      "maximumArtifactBytes": 67108864,
      "maximumOutputBytes": 1048576,
      "tmpfsBytes": 33554432
    }
  ]
}
