{
  "schemaVersion": 1,
  "id": "wine-netfx461-linux-x64",
  "image": "sharplabnext/runtime-wine-netfx461-linux-x64:candidate",
  "family": "netfx-clr-wine",
  "acceptedRuntimeFamilies": [
    "netfx-clr-wine"
  ],
  "acceptedFrameworks": [
    {
      "name": ".NETFramework",
      "exactVersion": "4.6.1"
    }
  ],
  "runtimeVersion": "4.6.1",
  "runtimeCommit": "not-applicable",
  "jitVersion": "not-applicable",
  "jitCommit": "not-applicable",
  "runtimeImageId": "sharplabnext/runtime-wine-netfx461-linux-x64:candidate",
  "rid": "linux-x64",
  "architecture": "x64",
  "cpuFeatureProfile": "x64-v2",
  "acceptedArtifactFormats": [
    "dotnet-framework-managed-pe-v1"
  ],
  "capabilities": [
    "run"
  ],
  "providedRuntimeFeatureTags": [],
  "providedMetadataFeatureTags": [],
  "allowedSecurityPolicyIds": [
    "runtime-job-wine-netfx"
  ],
  "container": {
    "isolationKind": "wine",
    "environmentKind": "wine",
    "executionUser": "0:0",
    "winePrefixPath": "/opt/wine-netfx-clr4"
  },
  "operations": {
    "run": {
      "implementationId": "sharplabnext-target-runtime-runner-v1",
      "pathStyle": "wine-z",
      "command": {
        "executable": "/usr/lib/wine/wine64",
        "argv": [
          "Z:\\opt\\sharplabnext\\SharpLabNext.TargetRuntimeRunner.exe",
          "run",
          "{entryAssembly}",
          "--",
          "{arguments}"
        ]
      }
    }
  },
  "layout": {
    "runnerKind": "wine-netfx",
    "dotNetHostPath": "/usr/lib/wine/wine64",
    "wineHostPath": "/usr/lib/wine/wine64",
    "winePrefixPath": "/opt/wine-netfx-clr4",
    "runnerAssemblyPath": "/opt/sharplabnext/SharpLabNext.TargetRuntimeRunner.exe"
  },
  "securityPolicies": [
    {
      "id": "runtime-job-wine-netfx",
      "memoryBytes": 1073741824,
      "nanoCpus": 1000000000,
      "pidsLimit": 64,
      "maximumDurationSeconds": 30,
      "maximumArtifactBytes": 67108864,
      "maximumOutputBytes": 1048576,
      "tmpfsBytes": 33554432
    }
  ]
}
