{
  "schemaVersion": 1,
  "id": "mono-6.12-linux-x64",
  "image": "sharplabnext/runtime-mono-6.12-linux-x64:candidate",
  "family": "mono",
  "acceptedRuntimeFamilies": [
    "mono",
    "netfx-clr-wine"
  ],
  "acceptedFrameworks": [
    {
      "name": ".NETFramework",
      "exactVersion": "4.8"
    }
  ],
  "runtimeVersion": "6.12.0.182",
  "runtimeCommit": "not-applicable",
  "jitVersion": "not-applicable",
  "jitCommit": "not-applicable",
  "runtimeImageId": "sharplabnext/runtime-mono-6.12-linux-x64:candidate",
  "rid": "linux-x64",
  "architecture": "x64",
  "cpuFeatureProfile": "x64-v2",
  "acceptedArtifactFormats": [
    "dotnet-framework-managed-pe-v1"
  ],
  "capabilities": [
    "run",
    "jit-asm"
  ],
  "providedRuntimeFeatureTags": [],
  "providedMetadataFeatureTags": [],
  "allowedSecurityPolicyIds": [
    "runtime-job-default"
  ],
  "container": {
    "isolationKind": "standard",
    "environmentKind": "mono",
    "executionUser": "1654:1654"
  },
  "operations": {
    "run": {
      "implementationId": "sharplabnext-target-runtime-runner-v1",
      "pathStyle": "unix",
      "command": {
        "executable": "/usr/bin/mono",
        "argv": [
          "/opt/sharplabnext/SharpLabNext.TargetRuntimeRunner.exe",
          "run",
          "{entryAssembly}",
          "--",
          "{arguments}"
        ]
      }
    },
    "jit": {
      "implementationId": "sharplabnext-mono-jit-inspector-v1",
      "pathStyle": "unix",
      "command": {
        "executable": "/usr/share/dotnet/dotnet",
        "argv": [
          "/opt/sharplabnext/SharpLabNext.MonoJitInspector.dll",
          "{entryAssembly}",
          "{methodFilter}"
        ]
      },
      "sourceMappingKind": "none"
    }
  },
  "layout": {
    "runnerKind": "dotnet",
    "dotNetHostPath": "/usr/bin/mono",
    "runnerAssemblyPath": "/opt/sharplabnext/SharpLabNext.TargetRuntimeRunner.exe",
    "jitInspectorAssemblyPath": "/opt/sharplabnext/SharpLabNext.MonoJitInspector.dll"
  },
  "securityPolicies": [
    {
      "id": "runtime-job-default",
      "memoryBytes": 268435456,
      "nanoCpus": 1000000000,
      "pidsLimit": 64,
      "maximumDurationSeconds": 10,
      "maximumArtifactBytes": 67108864,
      "maximumOutputBytes": 1048576,
      "tmpfsBytes": 33554432
    }
  ]
}
