{
  "schemaVersion": 1,
  "id": "wine-dotnet-5-linux-x64",
  "image": "sharplabnext/runtime-wine-dotnet-5-linux-x64:candidate",
  "family": "coreclr-wine",
  "acceptedRuntimeFamilies": [
    "coreclr-wine",
    "coreclr"
  ],
  "acceptedFrameworks": [
    {
      "name": "Microsoft.NETCore.App",
      "minimumVersion": "5.0.0",
      "maximumVersion": "5.0.17"
    }
  ],
  "runtimeVersion": "5.0.17",
  "runtimeCommit": "6a984143635bde23e728abaaccbde52f5ea8fa3e",
  "jitVersion": "5.0.17",
  "jitCommit": "6a984143635bde23e728abaaccbde52f5ea8fa3e",
  "runtimeImageId": "sharplabnext/runtime-wine-dotnet-5-linux-x64:candidate",
  "rid": "linux-x64",
  "architecture": "x64",
  "cpuFeatureProfile": "x64-v2",
  "acceptedArtifactFormats": [
    "dotnet-managed-pe-v1"
  ],
  "capabilities": [
    "run"
  ],
  "providedRuntimeFeatureTags": [],
  "providedMetadataFeatureTags": [],
  "allowedSecurityPolicyIds": [
    "runtime-job-default"
  ],
  "container": {
    "isolationKind": "wine",
    "environmentKind": "wine",
    "executionUser": "1654:1654",
    "winePrefixPath": "/opt/wine-dotnet"
  },
  "operations": {
    "run": {
      "implementationId": "sharplabnext-legacy-jit-inspector-v1",
      "pathStyle": "wine-z",
      "command": {
        "executable": "/usr/lib/wine/wine64",
        "argv": [
          "Z:\\opt\\wine-dotnet\\drive_c\\dotnet\\dotnet.exe",
          "exec",
          "--fx-version",
          "5.0.17",
          "Z:\\opt\\sharplabnext\\SharpLabNext.LegacyJitInspector.dll",
          "--runtime-version",
          "5.0.17",
          "run",
          "{entryAssembly}",
          "--",
          "{arguments}"
        ]
      }
    }
  },
  "layout": {
    "runnerKind": "wine-coreclr",
    "dotNetHostPath": "/opt/wine-dotnet/drive_c/dotnet/dotnet.exe",
    "wineHostPath": "/usr/lib/wine/wine64",
    "winePrefixPath": "/opt/wine-dotnet",
    "runnerAssemblyPath": "/opt/sharplabnext/SharpLabNext.LegacyJitInspector.dll"
  },
  "securityPolicies": [
    {
      "id": "runtime-job-default",
      "memoryBytes": 268435456,
      "nanoCpus": 1000000000,
      "pidsLimit": 64,
      "maximumDurationSeconds": 10,
      "maximumArtifactBytes": 67108864,
      "maximumOutputBytes": 1048576,
      "tmpfsBytes": 33554432
    }
  ]
}
