{
  "schemaVersion": 1,
  "id": "dotnet-6-linux-x64",
  "image": "sharplabnext/runtime-dotnet-6-linux-x64:candidate",
  "family": "coreclr",
  "acceptedRuntimeFamilies": [
    "coreclr"
  ],
  "acceptedFrameworks": [
    {
      "name": "Microsoft.NETCore.App",
      "exactVersion": "6.0.36"
    }
  ],
  "runtimeVersion": "6.0.36",
  "runtimeCommit": "f1dd57165bfd91875761329ac3a8b17f6606ad18",
  "jitVersion": "6.0.36",
  "jitCommit": "f1dd57165bfd91875761329ac3a8b17f6606ad18",
  "runtimeImageId": "sharplabnext/runtime-dotnet-6-linux-x64:candidate",
  "rid": "linux-x64",
  "architecture": "x64",
  "cpuFeatureProfile": "x64-v2",
  "acceptedArtifactFormats": [
    "dotnet-managed-pe-v1"
  ],
  "capabilities": [
    "run",
    "jit-asm"
  ],
  "providedRuntimeFeatureTags": [],
  "providedMetadataFeatureTags": [],
  "allowedSecurityPolicyIds": [
    "runtime-job-default"
  ],
  "container": {
    "isolationKind": "standard",
    "environmentKind": "coreclr",
    "executionUser": "1654:1654"
  },
  "operations": {
    "run": {
      "implementationId": "sharplabnext-legacy-jit-inspector-v1",
      "pathStyle": "unix",
      "command": {
        "executable": "/opt/sharplabnext/target-dotnet/dotnet",
        "argv": [
          "exec",
          "--fx-version",
          "6.0.36",
          "/opt/sharplabnext/SharpLabNext.LegacyJitInspector.dll",
          "--runtime-version",
          "6.0.36",
          "run",
          "{entryAssembly}",
          "--",
          "{arguments}"
        ]
      }
    },
    "jit": {
      "implementationId": "sharplabnext-checked-jit-bridge-v1",
      "pathStyle": "unix",
      "command": {
        "executable": "/opt/sharplabnext/target-dotnet/dotnet",
        "argv": [
          "/opt/sharplabnext/SharpLabNext.CheckedJitBridge.dll",
          "jit",
          "{entryAssembly}",
          "{methodFilter}"
        ]
      },
      "sourceMappingKind": "none"
    }
  },
  "layout": {
    "runnerKind": "dotnet",
    "dotNetHostPath": "/opt/sharplabnext/target-dotnet/dotnet",
    "runnerAssemblyPath": "/opt/sharplabnext/SharpLabNext.LegacyJitInspector.dll",
    "jitInspectorAssemblyPath": "/opt/sharplabnext/SharpLabNext.CheckedJitBridge.dll"
  },
  "securityPolicies": [
    {
      "id": "runtime-job-default",
      "memoryBytes": 268435456,
      "nanoCpus": 1000000000,
      "pidsLimit": 64,
      "maximumDurationSeconds": 10,
      "maximumArtifactBytes": 67108864,
      "maximumOutputBytes": 1048576,
      "tmpfsBytes": 33554432
    }
  ]
}
