{
  "schemaVersion": 1,
  "id": "dotnet-core-3.0-linux-x64",
  "image": "sharplabnext/runtime-dotnet-core-3.0-linux-x64:development",
  "family": "coreclr",
  "acceptedRuntimeFamilies": [
    "coreclr"
  ],
  "acceptedFrameworks": [
    {
      "name": "Microsoft.NETCore.App",
      "minimumVersion": "3.0.1",
      "maximumVersion": "3.0.3"
    }
  ],
  "runtimeVersion": "3.0.3",
  "runtimeCommit": "c03f2fe62663edec83d1bc12b4e9f11bd3de5d0e",
  "jitVersion": "3.0.3",
  "jitCommit": "c03f2fe62663edec83d1bc12b4e9f11bd3de5d0e",
  "runtimeImageId": "sha256:8e57d0a30fa159a1f5df950b134d89a7a1a2736ea2bf998c08a3b8eb9869b95c",
  "rid": "linux-x64",
  "architecture": "x64",
  "cpuFeatureProfile": "x64-v2",
  "acceptedArtifactFormats": [
    "dotnet-managed-pe-v1"
  ],
  "capabilities": [
    "run"
  ],
  "providedRuntimeFeatureTags": [],
  "providedMetadataFeatureTags": [],
  "allowedSecurityPolicyIds": [
    "runtime-job-default"
  ],
  "container": {
    "isolationKind": "standard",
    "environmentKind": "coreclr",
    "executionUser": "1654:1654"
  },
  "operations": {
    "run": {
      "implementationId": "sharplabnext-legacy-jit-inspector-v1",
      "pathStyle": "unix",
      "command": {
        "executable": "/opt/sharplabnext/target-dotnet/dotnet",
        "argv": [
          "exec",
          "--fx-version",
          "3.0.3",
          "/opt/sharplabnext/SharpLabNext.LegacyJitInspector.dll",
          "--runtime-version",
          "3.0.3",
          "run",
          "{entryAssembly}",
          "--",
          "{arguments}"
        ]
      }
    }
  },
  "layout": {
    "runnerKind": "dotnet",
    "dotNetHostPath": "/opt/sharplabnext/target-dotnet/dotnet",
    "runnerAssemblyPath": "/opt/sharplabnext/SharpLabNext.LegacyJitInspector.dll"
  },
  "securityPolicies": [
    {
      "id": "runtime-job-default",
      "memoryBytes": 268435456,
      "nanoCpus": 1000000000,
      "pidsLimit": 64,
      "maximumDurationSeconds": 10,
      "maximumArtifactBytes": 67108864,
      "maximumOutputBytes": 1048576,
      "tmpfsBytes": 33554432
    }
  ]
}
