{
  "schemaVersion": 1,
  "id": "const-generics-linux-x64",
  "image": "sharplabnext/runtime-const-generics:development",
  "family": "coreclr-const-generics",
  "acceptedRuntimeFamilies": [],
  "acceptedFrameworks": [
    {
      "name": "Microsoft.NETCore.App",
      "exactVersion": "9.0.0-constgenerics.1.23470.1"
    }
  ],
  "runtimeVersion": "9.0.0-constgenerics.1.23470.1",
  "runtimeCommit": "79f7f1408b2c811904c983419b45139e654f1e46",
  "jitVersion": "9.0.0-constgenerics.1.23470.1",
  "jitCommit": "79f7f1408b2c811904c983419b45139e654f1e46",
  "runtimeImageId": "sharplabnext/runtime-const-generics:development",
  "rid": "linux-x64",
  "architecture": "x64",
  "cpuFeatureProfile": "x64-v2",
  "acceptedArtifactFormats": [
    "dotnet-managed-pe-v1"
  ],
  "capabilities": [
    "run",
    "jit-asm",
    "inspection"
  ],
  "providedRuntimeFeatureTags": [
    "runtime.const-generics.v1"
  ],
  "providedMetadataFeatureTags": [
    "metadata.const-generics.v1"
  ],
  "allowedSecurityPolicyIds": [
    "runtime-job-default"
  ],
  "container": {
    "isolationKind": "standard",
    "environmentKind": "coreclr",
    "executionUser": "1654:1654"
  },
  "operations": {
    "run": {
      "implementationId": "sharplabnext-runner-v1",
      "pathStyle": "unix",
      "command": {
        "executable": "/usr/share/dotnet/dotnet",
        "argv": [
          "/opt/sharplabnext/SharpLabNext.Runner.dll",
          "{entryAssembly}",
          "--",
          "{arguments}"
        ]
      }
    },
    "jit": {
      "implementationId": "sharplabnext-jit-inspector-v1",
      "pathStyle": "unix",
      "command": {
        "executable": "/usr/share/dotnet/dotnet",
        "argv": [
          "/opt/sharplabnext/SharpLabNext.JitInspector.dll",
          "{entryAssembly}",
          "{methodFilter}"
        ]
      },
      "sourceMappingKind": "linux-profiler",
      "profilerPath": "/opt/sharplabnext/SharpLabNext.JitProfiler.so"
    }
  },
  "layout": {
    "runnerKind": "dotnet",
    "dotNetHostPath": "/usr/share/dotnet/dotnet",
    "runnerAssemblyPath": "/opt/sharplabnext/SharpLabNext.Runner.dll",
    "jitInspectorAssemblyPath": "/opt/sharplabnext/SharpLabNext.JitInspector.dll"
  },
  "securityPolicies": [
    {
      "id": "runtime-job-default",
      "memoryBytes": 268435456,
      "nanoCpus": 1000000000,
      "pidsLimit": 64,
      "maximumDurationSeconds": 10,
      "maximumArtifactBytes": 67108864,
      "maximumOutputBytes": 1048576,
      "tmpfsBytes": 33554432
    }
  ]
}
